{
  "schema_version": "1.0",
  "agent": "vc-code-generator",
  "command": "/build-small",
  "status": "success",
  "current_scope": {
    "summary": "Implement first bounded increment for SvelteKit issue tracker",
    "in_scope": [
      "Code generation",
      "Tests"
    ],
    "out_of_scope": [
      "Broad refactor"
    ]
  },
  "inputs_used": {
    "contracts": [
      ".ai/contracts/output-schema.md",
      ".ai/contracts/check-matrix.md",
      ".ai/contracts/execution-policy.json"
    ],
    "specs": [
      ".ai/specs/product-spec.md"
    ],
    "state_files": [
      ".ai/state/current-task.json",
      ".ai/state/plan.json"
    ],
    "stack": "sveltekit-web"
  },
  "files": {
    "to_change": [
      "src/main"
    ],
    "changed": [
      "src/main"
    ]
  },
  "acceptance": {
    "criteria_ids": [
      "AC-001"
    ],
    "coverage": [
      {
        "criterion_id": "AC-001",
        "planned_verification": [
          "typecheck",
          "smoke"
        ],
        "status": "planned"
      }
    ]
  },
  "risks": {
    "assumptions": [
      "No new dependencies needed"
    ],
    "open": [
      {
        "id": "RISK-001",
        "severity": "low",
        "status": "open",
        "summary": "Scope could expand"
      }
    ]
  },
  "validation": {
    "required_checks": [
      "lint",
      "build"
    ],
    "executed_checks": [
      "lint",
      "build"
    ],
    "results": [
      {
        "check_id": "lint",
        "status": "passed",
        "details": "Lint green"
      },
      {
        "check_id": "build",
        "status": "passed",
        "details": "Build green"
      }
    ]
  },
  "state_updates": [
    ".ai/state/changed-files.json",
    ".ai/state/test-results.json",
    ".ai/state/workflow-state.json",
    ".ai/state/execution-state.json"
  ],
  "remaining_out_of_scope": [
    "Release review"
  ],
  "next_action": "Run /review-release",
  "failure_class": "none",
  "severity": "low",
  "progress_state": "meaningful_progress",
  "recommended_action": "continue",
  "recommended_next_actor": "vc-orchestrator",
  "requires_rollback": false,
  "requires_human": false
}
