{
  "schema_version": "1.0",
  "agent": "vc-planner",
  "command": "/plan-feature",
  "status": "success",
  "current_scope": {
    "summary": "Create bounded implementation plan for FastAPI customer notes API",
    "in_scope": [
      "Bound increment",
      "Define checks"
    ],
    "out_of_scope": [
      "Release review"
    ]
  },
  "inputs_used": {
    "contracts": [
      ".ai/contracts/output-schema.md",
      ".ai/contracts/check-matrix.md",
      ".ai/contracts/execution-policy.json"
    ],
    "specs": [
      ".ai/specs/product-spec.md"
    ],
    "state_files": [
      ".ai/state/current-task.json",
      ".ai/state/plan.json"
    ],
    "stack": "fastapi-api"
  },
  "files": {
    "to_change": [
      ".ai/state/plan.json"
    ],
    "changed": []
  },
  "acceptance": {
    "criteria_ids": [
      "AC-001"
    ],
    "coverage": [
      {
        "criterion_id": "AC-001",
        "planned_verification": [
          "typecheck",
          "smoke"
        ],
        "status": "planned"
      }
    ]
  },
  "risks": {
    "assumptions": [
      "No new dependencies needed"
    ],
    "open": [
      {
        "id": "RISK-001",
        "severity": "low",
        "status": "open",
        "summary": "Scope could expand"
      }
    ]
  },
  "validation": {
    "required_checks": [
      "schema",
      "plan-contract"
    ],
    "executed_checks": [
      "schema"
    ],
    "results": [
      {
        "check_id": "schema",
        "status": "passed",
        "details": "Runtime JSON contract valid"
      }
    ]
  },
  "state_updates": [
    ".ai/state/plan.json",
    ".ai/state/workflow-state.json",
    ".ai/state/execution-state.json"
  ],
  "remaining_out_of_scope": [
    "Release review"
  ],
  "next_action": "Run /build-small",
  "failure_class": "none",
  "severity": "low",
  "progress_state": "meaningful_progress",
  "recommended_action": "continue",
  "recommended_next_actor": "vc-orchestrator",
  "requires_rollback": false,
  "requires_human": false
}
